[
  {
    "name": "Kleomedes",
    "identity": "037f777e3a71f9034ba575387eb139da09f7e4f23574d9ec8777bcfdb8b012e53a",
    "identityHistory": [],
    "url": "https://igniter.kleomed.es"
  },
  {
    "name": "Stakenodes",
    "identity": "03d0493c0977a303d055ab55dc1cfa5a89c302091db7f297948cfc82990659c6e1",
    "identityHistory": [],
    "url": "https://stakely.to.stakenodes.org"
  },
  {
    "name": "SpaceBelt",
    "identity": "03f66d7b67d4bcd31e993b8fc33e1b8ad52edc03b1a0314330f703e449452741e1",
    "identityHistory": [],
    "url": "https://igniter.spacebelt.xyz"
  },
  {
    "name": "Qspider",
    "identity": "02b6ad44ccd98d9bc4b39d27cb1a34ae08c5f4662633b822a8f7d8b7ba0c9584b2",
    "identityHistory": [],
    "url": "https://igniter.portal.qspider.com"
  },
  {
    "name": "Kalorius.tech",
    "identity": "03df4159adf6dc7809a94f882abff545c838944040e4c40bb78a657ca30b60aab1",
    "identityHistory": [],
    "url": "https://stake.kalorius.tech"
  },
  {
    "name": "Easy2stake",
    "identity": "02e2913bfd1e5b16c9a1e88af3669ff7bbb837fb3882d0fac4c33fb068db97e6f4",
    "identityHistory": [],
    "url": "https://provider-ui.easy2stake.com"
  },
  {
    "name": "BoilerBlockchain",
    "identity": "025c1c8bb1a3d37832ff18bb2cbcb9675d3264fe9621274c6998550cf6a6c50ff2",
    "identityHistory": [],
    "url": "https://igniter.pyras.org"
  },
  {
    "name": "Nodefleet",
    "identity": "03052ccec44479a54bb793611a57080dfc932bdeb1749553fed5fde2684a453aa4",
    "identityHistory": [],
    "url": "https://igniter.nodefleet.org"
  },
  {
    "name": "Poktpool",
    "identity": "0317c59dec4f0d0893217b52d65fde5c9e4bc118c0961de10ba4db58d86eecf2a6",
    "identityHistory": [],
    "url": "https://igniter.poktpool.com"
  },
  {
    "name": "WeaversNodes",
    "identity": "02a190e7d2814840c2bee2874486e1242e103d9897df72eec68e2da20c9ceaf40a",
    "identityHistory": [],
    "url": "https://igniter.weaversnodes.com"
  },
  {
    "name": "vido.info",
    "identity": "03b3dc444a81ba21e220116360fa5f9365c1fe357ecd2aa7abd8899955775db6ce",
    "identityHistory": [],
    "url": "https://igniter.vido.info"
  },
  {
    "name": "Stake&Relax 🦥",
    "identity": "02332bb776eff191434f796044c1f814043e7362dfc9245aa67a2f9732e3b90fe1",
    "identityHistory": [],
    "url": "https://igniter.stakeandrelax.net"
  },
  {
    "name": "High Stakes 🇨🇭",
    "identity": "0396f3874516c5db51f1478bcf1114813ef9a6950dcc5dfa99f951342aac95eef9",
    "identityHistory": [],
    "url": "https://pocket-igniter.highstakes.ch/"
  },
  {
    "name": "purroofgroup",
    "identity": "03427a2568ce2ce0268c551c636f7afb2504ecd388fa45cb652b1350175317f459",
    "identityHistory": [],
    "url": "https://igniter.purroofgroup.com"
  },
  {
    "name": "SGTstake",
    "identity": "0314616019c40224f191fd09d97a728dfdd6cd61919982168fddcf81509c399798",
    "identityHistory": [],
    "url": "https://igniter.sgtstake.com/"
  },
  {
    "name": "NodesHub",
    "identity": "03b4c19db631e49d47cbeaefc9fd3f73006c37449739ef111031281b8311789105",
    "identityHistory": [],
    "url": "https://igniter.pocket-nodeshub.com"
  },
  {
    "name": "HostDeFi",
    "identity": "022dc0d4300ce9987826f64c847bfb8d0be215e9dce1474313aba638a6c414f358",
    "identityHistory": [],
    "url": "https://igniter.hostdefi.com"
  }
]
